GENE NAME,PARAGRAPH 1 (Gene Association),PARAGRAPH 2 (Gene Condition),PARAGRAPH 3 (Gene Condition Overflow),A2M CURVE,A2M REQUESTS,HideA2MCharts,SQL,Concatenated
RINT1,"The RINT1 gene is associated with autosomal recessive Infantile liver failure syndrome (MedGen UID: 1684678). There is also preliminary evidence supporting a correlation with breast cancer (PMID: 25050558, 33099839). The data, however, are preliminary and insufficient to make a determination regarding this relationship.","Infantile liver failure syndrome is characterized by episodic acute liver failure usually triggered by an intercurrent illness. The first event typically occurs in early childhood with episodic liver dysfunction, hyperammonemia and coagulopathy. With supportive treatment, the episodes resolve, though liver function may not normalize entirely (PMID: 31204009). Accumulated liver injury in the form of steatosis, bridging fibrosis, and increased Kupffer cells, caused at least one child to undergo liver transplant. Laboratory findings include elevated liver enzymes, total and direct hyperbilirubinemia, with increased prothrombin time and INRs (PMID: 31204009). Additional features of RALF include short stature and vertebral anomalies, with platyspondyly, hypoplastic, beaked and/or irregular vertebrae. Irregular femoral head epiphyses have also been described. Though only a few affected individuals have been reported to date, thus far all have had normal development and cognitive function (PMID: 31204009).",,NO,,,"('RINT1', 'The RINT1 gene is associated with autosomal recessive Infantile liver failure syndrome (MedGen UID: 1684678). There is also preliminary evidence supporting a correlation with breast cancer (PMID: 25050558, 33099839). The data, however, are preliminary and insufficient to make a determination regarding this relationship.', 'Infantile liver failure syndrome is characterized by episodic acute liver failure usually triggered by an intercurrent illness. The first event typically occurs in early childhood with episodic liver dysfunction, hyperammonemia and coagulopathy. With supportive treatment, the episodes resolve, though liver function may not normalize entirely (PMID: 31204009). Accumulated liver injury in the form of steatosis, bridging fibrosis, and increased Kupffer cells, caused at least one child to undergo liver transplant. Laboratory findings include elevated liver enzymes, total and direct hyperbilirubinemia, with increased prothrombin time and INRs (PMID: 31204009). Additional features of RALF include short stature and vertebral anomalies, with platyspondyly, hypoplastic, beaked and/or irregular vertebrae. Irregular femoral head epiphyses have also been described. Though only a few affected individuals have been reported to date, thus far all have had normal development and cognitive function (PMID: 31204009).', '', '0', NULL),","The RINT1 gene is associated with autosomal recessive Infantile liver failure syndrome (MedGen UID: 1684678). There is also preliminary evidence supporting a correlation with breast cancer (PMID: 25050558, 33099839). The data, however, are preliminary and insufficient to make a determination regarding this relationship.  Infantile liver failure syndrome is characterized by episodic acute liver failure usually triggered by an intercurrent illness. The first event typically occurs in early childhood with episodic liver dysfunction, hyperammonemia and coagulopathy. With supportive treatment, the episodes resolve, though liver function may not normalize entirely (PMID: 31204009). Accumulated liver injury in the form of steatosis, bridging fibrosis, and increased Kupffer cells, caused at least one child to undergo liver transplant. Laboratory findings include elevated liver enzymes, total and direct hyperbilirubinemia, with increased prothrombin time and INRs (PMID: 31204009). Additional features of RALF include short stature and vertebral anomalies, with platyspondyly, hypoplastic, beaked and/or irregular vertebrae. Irregular femoral head epiphyses have also been described. Though only a few affected individuals have been reported to date, thus far all have had normal development and cognitive function (PMID: 31204009)."
RNF43,"The RNF43 gene currently has no well-established disease association; however, there is preliminary evidence supporting a correlation with autosomal dominant predisposition to colorectal cancer (PMID: 31243857).",,,NO,,,"('RNF43', 'The RNF43 gene currently has no well-established disease association; however, there is preliminary evidence supporting a correlation with autosomal dominant predisposition to colorectal cancer (PMID: 31243857).', '', '', '0', NULL),","The RNF43 gene currently has no well-established disease association; however, there is preliminary evidence supporting a correlation with autosomal dominant predisposition to colorectal cancer (PMID: 31243857)."
RPS20,"The RPS20 gene currently has no well-established disease association; however, there is preliminary evidence supporting a correlation with autosomal dominant hereditary nonpolyposis colorectal cancer (HNPCC) (PMID: 24941021).",,,NO,,,"('RPS20', 'The RPS20 gene currently has no well-established disease association; however, there is preliminary evidence supporting a correlation with autosomal dominant hereditary nonpolyposis colorectal cancer (HNPCC) (PMID: 24941021).', '', '', '0', NULL),","The RPS20 gene currently has no well-established disease association; however, there is preliminary evidence supporting a correlation with autosomal dominant hereditary nonpolyposis colorectal cancer (HNPCC) (PMID: 24941021)."
RUNX1,The RUNX1 gene is associated with autosomal dominant familial platelet disorder with associated myeloid malignancy (MedGen UID: 321945).,"Familial platelet disorder is characterized by mild to moderate thrombocytopenia, platelet abnormalities, and a predisposition to develop myelodysplasia and/or acute myeloid leukemia (PMID: 19357396, 18723428). It should be noted that acquired (somatic) variants may arise in the blood, particularly with advancing age, and may even appear heterozygous (PMID: 25426837, 25426838, 31490007, 31881331). Results from blood or saliva specimens alone may not distinguish between germline and acquired RUNX1 variants and additional testing may be appropriate.",,NO,,,"('RUNX1', 'The RUNX1 gene is associated with autosomal dominant familial platelet disorder with associated myeloid malignancy (MedGen UID: 321945).', 'Familial platelet disorder is characterized by mild to moderate thrombocytopenia, platelet abnormalities, and a predisposition to develop myelodysplasia and/or acute myeloid leukemia (PMID: 19357396, 18723428). It should be noted that acquired (somatic) variants may arise in the blood, particularly with advancing age, and may even appear heterozygous (PMID: 25426837, 25426838, 31490007, 31881331). Results from blood or saliva specimens alone may not distinguish between germline and acquired RUNX1 variants and additional testing may be appropriate.', '', '0', NULL),","The RUNX1 gene is associated with autosomal dominant familial platelet disorder with associated myeloid malignancy (MedGen UID: 321945).  Familial platelet disorder is characterized by mild to moderate thrombocytopenia, platelet abnormalities, and a predisposition to develop myelodysplasia and/or acute myeloid leukemia (PMID: 19357396, 18723428). It should be noted that acquired (somatic) variants may arise in the blood, particularly with advancing age, and may even appear heterozygous (PMID: 25426837, 25426838, 31490007, 31881331). Results from blood or saliva specimens alone may not distinguish between germline and acquired RUNX1 variants and additional testing may be appropriate."
SDHA,"The SDHA gene is associated with autosomal dominant hereditary paraganglioma-pheochromocytoma (PGL-PCC) syndrome (MedGen UID: 481622), gastrointestinal stromal tumors (GIST) (PMID: 20301715), and autosomal recessive mitochondrial complex II deficiency with or without cardiomyopathy (MedGen UID: 344401). Studies suggest SDHA may also be associated with autosomal dominant predisposition to renal cancer (PMID: 26722403) and pituitary adenomas (PMID: 26259135). The data, however, are preliminary and insufficient to make a determination regarding these relationships.","SDHA-associated PGL-PCC syndrome due to loss-of-function (LOF) variants is characterized by an increased risk of developing PGL and PCC. Germline LOF SDHA variants have also been identified in individuals and families with GIST (PMID: 21505157, 22974104, 23060355) and Carney-Stratakis syndrome, which is associated with both PGL and GIST. The lifetime risk to develop a SDHA-related tumor is estimated to be 1-10% (PMID: 29177515, 29978154, 30201732); however, the risk of malignant transformation is unclear. While the SDHA gene is associated with autosomal dominant mitochondrial complex II deficiency, LOF variants in this gene have not been observed in individuals with this condition.","Autosomal recessive mitochondrial complex II deficiency with or without cardiomyopathy is characterized by progressive encephalopathy, myopathy, hypotonia and leukodystrophy (PMID: 22972948, 23322652, 27683074). Poor growth, short stature and joint contractures are common findings while only a subset of affected individuals also develop cardiomyopathy (PMID: 22972948, 23322652). The severity of features is highly variable, ranging from adult-onset of milder symptoms with normal cognition to severe, life-threatening infantile onset (PMID: 23322652). Clinical correlation is advised.",NO,,,"('SDHA', 'The SDHA gene is associated with autosomal dominant hereditary paraganglioma-pheochromocytoma (PGL-PCC) syndrome (MedGen UID: 481622), gastrointestinal stromal tumors (GIST) (PMID: 20301715), and autosomal recessive mitochondrial complex II deficiency with or without cardiomyopathy (MedGen UID: 344401). Studies suggest SDHA may also be associated with autosomal dominant predisposition to renal cancer (PMID: 26722403) and pituitary adenomas (PMID: 26259135). The data, however, are preliminary and insufficient to make a determination regarding these relationships.', 'SDHA-associated PGL-PCC syndrome due to loss-of-function (LOF) variants is characterized by an increased risk of developing PGL and PCC. Germline LOF SDHA variants have also been identified in individuals and families with GIST (PMID: 21505157, 22974104, 23060355) and Carney-Stratakis syndrome, which is associated with both PGL and GIST. The lifetime risk to develop a SDHA-related tumor is estimated to be 1-10% (PMID: 29177515, 29978154, 30201732); however, the risk of malignant transformation is unclear. While the SDHA gene is associated with autosomal dominant mitochondrial complex II deficiency, LOF variants in this gene have not been observed in individuals with this condition.', 'Autosomal recessive mitochondrial complex II deficiency with or without cardiomyopathy is characterized by progressive encephalopathy, myopathy, hypotonia and leukodystrophy (PMID: 22972948, 23322652, 27683074). Poor growth, short stature and joint contractures are common findings while only a subset of affected individuals also develop cardiomyopathy (PMID: 22972948, 23322652). The severity of features is highly variable, ranging from adult-onset of milder symptoms with normal cognition to severe, life-threatening infantile onset (PMID: 23322652). Clinical correlation is advised.', '0', NULL),","The SDHA gene is associated with autosomal dominant hereditary paraganglioma-pheochromocytoma (PGL-PCC) syndrome (MedGen UID: 481622), gastrointestinal stromal tumors (GIST) (PMID: 20301715), and autosomal recessive mitochondrial complex II deficiency with or without cardiomyopathy (MedGen UID: 344401). Studies suggest SDHA may also be associated with autosomal dominant predisposition to renal cancer (PMID: 26722403) and pituitary adenomas (PMID: 26259135). The data, however, are preliminary and insufficient to make a determination regarding these relationships.  SDHA-associated PGL-PCC syndrome due to loss-of-function (LOF) variants is characterized by an increased risk of developing PGL and PCC. Germline LOF SDHA variants have also been identified in individuals and families with GIST (PMID: 21505157, 22974104, 23060355) and Carney-Stratakis syndrome, which is associated with both PGL and GIST. The lifetime risk to develop a SDHA-related tumor is estimated to be 1-10% (PMID: 29177515, 29978154, 30201732); however, the risk of malignant transformation is unclear. While the SDHA gene is associated with autosomal dominant mitochondrial complex II deficiency, LOF variants in this gene have not been observed in individuals with this condition.  Autosomal recessive mitochondrial complex II deficiency with or without cardiomyopathy is characterized by progressive encephalopathy, myopathy, hypotonia and leukodystrophy (PMID: 22972948, 23322652, 27683074). Poor growth, short stature and joint contractures are common findings while only a subset of affected individuals also develop cardiomyopathy (PMID: 22972948, 23322652). The severity of features is highly variable, ranging from adult-onset of milder symptoms with normal cognition to severe, life-threatening infantile onset (PMID: 23322652). Clinical correlation is advised."
SDHAF2,The SDHAF2 gene is associated with autosomal dominant hereditary paraganglioma-pheochromocytoma (PGL-PCC) syndrome (MedGen UID: 357076).,"Hereditary PGL-PCC syndrome is characterized by an increased lifetime risk for PGLs and PCCs. Pathogenic SDHAF2 variants predispose individuals to multiple head and neck paragangliomas, especially at early ages, although the lifetime risk of developing these tumors is unclear (PMID: 21224366, 20071235, 22241717). While the SDHAF2 gene follows traditional Mendelian inheritance, there is evidence suggesting a parent-of-origin effect; it appears that the risk of disease may be limited to paternally inherited pathogenic variants (PMID: 28099933, 21224366).",,NO,,,"('SDHAF2', 'The SDHAF2 gene is associated with autosomal dominant hereditary paraganglioma-pheochromocytoma (PGL-PCC) syndrome (MedGen UID: 357076).', 'Hereditary PGL-PCC syndrome is characterized by an increased lifetime risk for PGLs and PCCs. Pathogenic SDHAF2 variants predispose individuals to multiple head and neck paragangliomas, especially at early ages, although the lifetime risk of developing these tumors is unclear (PMID: 21224366, 20071235, 22241717). While the SDHAF2 gene follows traditional Mendelian inheritance, there is evidence suggesting a parent-of-origin effect; it appears that the risk of disease may be limited to paternally inherited pathogenic variants (PMID: 28099933, 21224366).', '', '0', NULL),","The SDHAF2 gene is associated with autosomal dominant hereditary paraganglioma-pheochromocytoma (PGL-PCC) syndrome (MedGen UID: 357076).  Hereditary PGL-PCC syndrome is characterized by an increased lifetime risk for PGLs and PCCs. Pathogenic SDHAF2 variants predispose individuals to multiple head and neck paragangliomas, especially at early ages, although the lifetime risk of developing these tumors is unclear (PMID: 21224366, 20071235, 22241717). While the SDHAF2 gene follows traditional Mendelian inheritance, there is evidence suggesting a parent-of-origin effect; it appears that the risk of disease may be limited to paternally inherited pathogenic variants (PMID: 28099933, 21224366)."
SDHB,"The SDHB gene is associated with autosomal dominant hereditary paraganglioma-pheochromocytoma (PGL-PCC) syndrome (MedGen UID: 349380), gastrointestinal stromal tumors (GIST) (MedGen UID: 116049), renal cancer (PMID: 29386252, 23083876) and autosomal recessive mitochondrial complex II deficiency with or without cardiomyopathy (MedGen UID: 344401). Studies suggest SDHB may also be associated with autosomal dominant predisposition to pituitary adenomas (PMID: 26259135). The data, however, are preliminary and insufficient to make a determination regarding this relationship.","Hereditary PGL-PCC syndrome is characterized by an increased lifetime risk for PGL and PCC. SDHB is also associated with autosomal dominant predisposition to renal cancer (PMID: 18728283, 23083876), GIST (PMID: 28374168, 29386252) and Carney-Stratakis syndrome, which is associated with both GIST and PGL (PMID: 17667967). The lifetime risk of developing PGL and/or PCC is 22-49% (PMID: 28374168, 29386252, 30201732). PGL, PCC and GIST are typically benign but have a risk of malignant transformation; lifetime cancer risks are not clear (PMID: 30536464, 29386252). There is approximately a 5% risk of kidney cancer to age 60 (PMID: 29386252, 23083876).","Mitochondrial complex II deficiency is characterized by progressive encephalopathy, myopathy, hypotonia and leukodystrophy. Poor growth, short stature and joint contractures are common findings while only a subset of affected individuals also develop cardiomyopathy. The severity of features is highly variable, ranging from adult-onset of milder symptoms with normal cognition to severe, life-threatening infantile onset (PMID: 22972948, 23322652).",NO,,,"('SDHB', 'The SDHB gene is associated with autosomal dominant hereditary paraganglioma-pheochromocytoma (PGL-PCC) syndrome (MedGen UID: 349380), gastrointestinal stromal tumors (GIST) (MedGen UID: 116049), renal cancer (PMID: 29386252, 23083876) and autosomal recessive mitochondrial complex II deficiency with or without cardiomyopathy (MedGen UID: 344401). Studies suggest SDHB may also be associated with autosomal dominant predisposition to pituitary adenomas (PMID: 26259135). The data, however, are preliminary and insufficient to make a determination regarding this relationship.', 'Hereditary PGL-PCC syndrome is characterized by an increased lifetime risk for PGL and PCC. SDHB is also associated with autosomal dominant predisposition to renal cancer (PMID: 18728283, 23083876), GIST (PMID: 28374168, 29386252) and Carney-Stratakis syndrome, which is associated with both GIST and PGL (PMID: 17667967). The lifetime risk of developing PGL and/or PCC is 22-49% (PMID: 28374168, 29386252, 30201732). PGL, PCC and GIST are typically benign but have a risk of malignant transformation; lifetime cancer risks are not clear (PMID: 30536464, 29386252). There is approximately a 5% risk of kidney cancer to age 60 (PMID: 29386252, 23083876).', 'Mitochondrial complex II deficiency is characterized by progressive encephalopathy, myopathy, hypotonia and leukodystrophy. Poor growth, short stature and joint contractures are common findings while only a subset of affected individuals also develop cardiomyopathy. The severity of features is highly variable, ranging from adult-onset of milder symptoms with normal cognition to severe, life-threatening infantile onset (PMID: 22972948, 23322652).', '0', NULL),","The SDHB gene is associated with autosomal dominant hereditary paraganglioma-pheochromocytoma (PGL-PCC) syndrome (MedGen UID: 349380), gastrointestinal stromal tumors (GIST) (MedGen UID: 116049), renal cancer (PMID: 29386252, 23083876) and autosomal recessive mitochondrial complex II deficiency with or without cardiomyopathy (MedGen UID: 344401). Studies suggest SDHB may also be associated with autosomal dominant predisposition to pituitary adenomas (PMID: 26259135). The data, however, are preliminary and insufficient to make a determination regarding this relationship.  Hereditary PGL-PCC syndrome is characterized by an increased lifetime risk for PGL and PCC. SDHB is also associated with autosomal dominant predisposition to renal cancer (PMID: 18728283, 23083876), GIST (PMID: 28374168, 29386252) and Carney-Stratakis syndrome, which is associated with both GIST and PGL (PMID: 17667967). The lifetime risk of developing PGL and/or PCC is 22-49% (PMID: 28374168, 29386252, 30201732). PGL, PCC and GIST are typically benign but have a risk of malignant transformation; lifetime cancer risks are not clear (PMID: 30536464, 29386252). There is approximately a 5% risk of kidney cancer to age 60 (PMID: 29386252, 23083876).  Mitochondrial complex II deficiency is characterized by progressive encephalopathy, myopathy, hypotonia and leukodystrophy. Poor growth, short stature and joint contractures are common findings while only a subset of affected individuals also develop cardiomyopathy. The severity of features is highly variable, ranging from adult-onset of milder symptoms with normal cognition to severe, life-threatening infantile onset (PMID: 22972948, 23322652)."
SDHC,"The SDHC gene is associated with autosomal dominant hereditary paraganglioma-pheochromocytoma (PGL-PCC) syndrome (MedGen UID: 340200), gastrointestinal stromal tumors (GIST) (MedGen UID: 116049) and renal cancer (PMID: 23083876).  Studies also suggest SDHC may be associated with autosomal dominant predisposition to pituitary adenomas (PMID: 26259135). The data, however, are preliminary and available evidence is insufficient to make a determination regarding this relationship.","SDHC-associated hereditary PGL-PCC syndrome is associated with an 8-25% risk of developing PGL and/or PCC that are typically benign (PMID: 30201732, 29386252). Affected individuals will more often develop PGL in the head and neck. SDHC is also associated with autosomal dominant predisposition to to renal cancer (PMID: 23083876), GIST and Carney-Stratakis syndrome, which is associated with both GIST and PGL (PMID: 17667967, 21173220). PGL, PCC and GIST may become malignant; however, lifetime cancer risks are not clear. The lifetime risk of renal cancer is not established.",,NO,,,"('SDHC', 'The SDHC gene is associated with autosomal dominant hereditary paraganglioma-pheochromocytoma (PGL-PCC) syndrome (MedGen UID: 340200), gastrointestinal stromal tumors (GIST) (MedGen UID: 116049) and renal cancer (PMID: 23083876).  Studies also suggest SDHC may be associated with autosomal dominant predisposition to pituitary adenomas (PMID: 26259135). The data, however, are preliminary and available evidence is insufficient to make a determination regarding this relationship.', 'SDHC-associated hereditary PGL-PCC syndrome is associated with an 8-25% risk of developing PGL and/or PCC that are typically benign (PMID: 30201732, 29386252). Affected individuals will more often develop PGL in the head and neck. SDHC is also associated with autosomal dominant predisposition to to renal cancer (PMID: 23083876), GIST and Carney-Stratakis syndrome, which is associated with both GIST and PGL (PMID: 17667967, 21173220). PGL, PCC and GIST may become malignant; however, lifetime cancer risks are not clear. The lifetime risk of renal cancer is not established.', '', '0', NULL),","The SDHC gene is associated with autosomal dominant hereditary paraganglioma-pheochromocytoma (PGL-PCC) syndrome (MedGen UID: 340200), gastrointestinal stromal tumors (GIST) (MedGen UID: 116049) and renal cancer (PMID: 23083876).  Studies also suggest SDHC may be associated with autosomal dominant predisposition to pituitary adenomas (PMID: 26259135). The data, however, are preliminary and available evidence is insufficient to make a determination regarding this relationship.  SDHC-associated hereditary PGL-PCC syndrome is associated with an 8-25% risk of developing PGL and/or PCC that are typically benign (PMID: 30201732, 29386252). Affected individuals will more often develop PGL in the head and neck. SDHC is also associated with autosomal dominant predisposition to to renal cancer (PMID: 23083876), GIST and Carney-Stratakis syndrome, which is associated with both GIST and PGL (PMID: 17667967, 21173220). PGL, PCC and GIST may become malignant; however, lifetime cancer risks are not clear. The lifetime risk of renal cancer is not established."
