GENE NAME,PARAGRAPH 1 (Gene Association),PARAGRAPH 2 (Gene Condition),PARAGRAPH 3 (Gene Condition Overflow),A2M CURVE,A2M REQUESTS,HideA2MCharts,SQL,Concatenated
CDKN2A/p14,"The CDKN2A gene is associated with autosomal dominant melanoma-pancreatic cancer syndrome (MedGen UID: 325450) and melanoma-neural system tumor (NST) syndrome (MedGen UID: 331890). The CDKN2A gene encodes two main proteins, p16INK4a and p14ARF.","The variant identified in this individual impacts the p14ARF protein, which is associated with melanoma-NST syndrome. Affected individuals have an increased risk of developing multiple melanocytic nevi, cutaneous melanoma and neural system tumors including astrocytoma and nerve sheath tumors (PMID: 9622062, 11136714, 17047042). Variants that only affect the p14ARF transcript are not known to be associated with pancreatic cancer. The cancer risks for individuals who have homozygous or compound heterozygous CDKN2A pathogenic variants are currently unknown.",,NO,,,"('CDKN2A/p14', 'The CDKN2A gene is associated with autosomal dominant melanoma-pancreatic cancer syndrome (MedGen UID: 325450) and melanoma-neural system tumor (NST) syndrome (MedGen UID: 331890). The CDKN2A gene encodes two main proteins, p16INK4a and p14ARF.', 'The variant identified in this individual impacts the p14ARF protein, which is associated with melanoma-NST syndrome. Affected individuals have an increased risk of developing multiple melanocytic nevi, cutaneous melanoma and neural system tumors including astrocytoma and nerve sheath tumors (PMID: 9622062, 11136714, 17047042). Variants that only affect the p14ARF transcript are not known to be associated with pancreatic cancer. The cancer risks for individuals who have homozygous or compound heterozygous CDKN2A pathogenic variants are currently unknown.', '', '0', NULL),","The CDKN2A gene is associated with autosomal dominant melanoma-pancreatic cancer syndrome (MedGen UID: 325450) and melanoma-neural system tumor (NST) syndrome (MedGen UID: 331890). The CDKN2A gene encodes two main proteins, p16INK4a and p14ARF.  The variant identified in this individual impacts the p14ARF protein, which is associated with melanoma-NST syndrome. Affected individuals have an increased risk of developing multiple melanocytic nevi, cutaneous melanoma and neural system tumors including astrocytoma and nerve sheath tumors (PMID: 9622062, 11136714, 17047042). Variants that only affect the p14ARF transcript are not known to be associated with pancreatic cancer. The cancer risks for individuals who have homozygous or compound heterozygous CDKN2A pathogenic variants are currently unknown."
CDKN2A/p16,"The CDKN2A gene is associated with autosomal dominant melanoma-pancreatic cancer syndrome (MedGen UID: 325450) and melanoma-neural system tumor (NST) syndrome (MedGen UID: 331890). The CDKN2A gene encodes two main proteins, p16INK4a and p14ARF.","The variant identified in this individual impacts the p16INK4a protein, which is associated with melanoma-pancreatic cancer syndrome, also known as familial atypical multiple mole melanoma (FAMMM) syndrome. Affected individuals have an increased risk of developing multiple melanocytic nevi, cutaneous melanoma and pancreatic cancer. The lifetime risk of melanoma is 28-67%; the risk of pancreatic cancer is approximately 17% (PMID: 12072543, 16234564, 10956390, 24935963) although one study has suggested the risk may be up to 58% (PMID: 21150883). Variants affecting only the p16INK4a transcript are not known to be associated with neural system tumors. The cancer risks for individuals who have homozygous or compound heterozygous CDKN2A pathogenic variants is currently unknown.",,NO,Hide All due to content alignment needs,,"('CDKN2A/p16', 'The CDKN2A gene is associated with autosomal dominant melanoma-pancreatic cancer syndrome (MedGen UID: 325450) and melanoma-neural system tumor (NST) syndrome (MedGen UID: 331890). The CDKN2A gene encodes two main proteins, p16INK4a and p14ARF.', 'The variant identified in this individual impacts the p16INK4a protein, which is associated with melanoma-pancreatic cancer syndrome, also known as familial atypical multiple mole melanoma (FAMMM) syndrome. Affected individuals have an increased risk of developing multiple melanocytic nevi, cutaneous melanoma and pancreatic cancer. The lifetime risk of melanoma is 28-67%; the risk of pancreatic cancer is approximately 17% (PMID: 12072543, 16234564, 10956390, 24935963) although one study has suggested the risk may be up to 58% (PMID: 21150883). Variants affecting only the p16INK4a transcript are not known to be associated with neural system tumors. The cancer risks for individuals who have homozygous or compound heterozygous CDKN2A pathogenic variants is currently unknown. ', '', '0', ''),","The CDKN2A gene is associated with autosomal dominant melanoma-pancreatic cancer syndrome (MedGen UID: 325450) and melanoma-neural system tumor (NST) syndrome (MedGen UID: 331890). The CDKN2A gene encodes two main proteins, p16INK4a and p14ARF.  The variant identified in this individual impacts the p16INK4a protein, which is associated with melanoma-pancreatic cancer syndrome, also known as familial atypical multiple mole melanoma (FAMMM) syndrome. Affected individuals have an increased risk of developing multiple melanocytic nevi, cutaneous melanoma and pancreatic cancer. The lifetime risk of melanoma is 28-67%; the risk of pancreatic cancer is approximately 17% (PMID: 12072543, 16234564, 10956390, 24935963) although one study has suggested the risk may be up to 58% (PMID: 21150883). Variants affecting only the p16INK4a transcript are not known to be associated with neural system tumors. The cancer risks for individuals who have homozygous or compound heterozygous CDKN2A pathogenic variants is currently unknown."
CEBPA,The CEBPA gene is associated with autosomal dominant predisposition to familial acute myeloid leukemia (AML) (MedGen UID: 9730).,"Familial AML is characterized by multiple diagnoses of this cancer type within a family. The age at diagnosis can be variable; however, it appears to have an earlier onset than sporadic cases (PMID: 18946494, 26162409).",,NO,,,"('CEBPA', 'The CEBPA gene is associated with autosomal dominant predisposition to familial acute myeloid leukemia (AML) (MedGen UID: 9730).', 'Familial AML is characterized by multiple diagnoses of this cancer type within a family. The age at diagnosis can be variable; however, it appears to have an earlier onset than sporadic cases (PMID: 18946494, 26162409).', '', '0', NULL),","The CEBPA gene is associated with autosomal dominant predisposition to familial acute myeloid leukemia (AML) (MedGen UID: 9730).  Familial AML is characterized by multiple diagnoses of this cancer type within a family. The age at diagnosis can be variable; however, it appears to have an earlier onset than sporadic cases (PMID: 18946494, 26162409)."
CFTR,"The CFTR gene is associated with autosomal recessive cystic fibrosis (CF) (MedGen UID: 41393) and congenital bilateral absence of the vas deferens (CBAVD) (MedGen UID: 98021). Additionally, CFTR is associated with an increased risk for chronic pancreatitis (PMID: 17003641, 11729110).","Cystic fibrosis (CF) is usually a childhood onset disease characterized by the buildup of mucus that can damage the digestive and respiratory systems. Milder forms of CFTR-related disorders include congenital absence of the vas deferens (CAVD) (MedGen UID: 430259) associated with infertility, respiratory manifestations, and hereditary pancreatitis (MedGen UID: 116056). Pathogenic variants in CFTR may confer an approximately 4-10 fold increased risk for chronic pancreatitis in heterozygous carriers (PMID: 20977904, 21520337, 11729110), although the absolute risk of pancreatitis remains low (less than 1 in 100; PMID: 31882447). Hereditary pancreatitis is characterized by recurrent episodes of acute inflammation of the pancreas (pancreatitis) beginning in childhood or adolescence leading to chronic pancreatitis. Chronic pancreatitis is a risk factor for pancreatic cancer (PMID: 25170203). The combination of variants identified in an affected individual impacts the observed clinical features and severity of the disorders (PMID: 20301428, 24624459).",,NO,,,"('CFTR', 'The CFTR gene is associated with autosomal recessive cystic fibrosis (CF) (MedGen UID: 41393) and congenital bilateral absence of the vas deferens (CBAVD) (MedGen UID: 98021). Additionally, CFTR is associated with an increased risk for chronic pancreatitis (PMID: 17003641, 11729110). ', 'Cystic fibrosis (CF) is usually a childhood onset disease characterized by the buildup of mucus that can damage the digestive and respiratory systems. Milder forms of CFTR-related disorders include congenital absence of the vas deferens (CAVD) (MedGen UID: 430259) associated with infertility, respiratory manifestations, and hereditary pancreatitis (MedGen UID: 116056). Pathogenic variants in CFTR may confer an approximately 4-10 fold increased risk for chronic pancreatitis in heterozygous carriers (PMID: 20977904, 21520337, 11729110), although the absolute risk of pancreatitis remains low (less than 1 in 100; PMID: 31882447). Hereditary pancreatitis is characterized by recurrent episodes of acute inflammation of the pancreas (pancreatitis) beginning in childhood or adolescence leading to chronic pancreatitis. Chronic pancreatitis is a risk factor for pancreatic cancer (PMID: 25170203). The combination of variants identified in an affected individual impacts the observed clinical features and severity of the disorders (PMID: 20301428, 24624459).', '', '0', NULL),","The CFTR gene is associated with autosomal recessive cystic fibrosis (CF) (MedGen UID: 41393) and congenital bilateral absence of the vas deferens (CBAVD) (MedGen UID: 98021). Additionally, CFTR is associated with an increased risk for chronic pancreatitis (PMID: 17003641, 11729110).   Cystic fibrosis (CF) is usually a childhood onset disease characterized by the buildup of mucus that can damage the digestive and respiratory systems. Milder forms of CFTR-related disorders include congenital absence of the vas deferens (CAVD) (MedGen UID: 430259) associated with infertility, respiratory manifestations, and hereditary pancreatitis (MedGen UID: 116056). Pathogenic variants in CFTR may confer an approximately 4-10 fold increased risk for chronic pancreatitis in heterozygous carriers (PMID: 20977904, 21520337, 11729110), although the absolute risk of pancreatitis remains low (less than 1 in 100; PMID: 31882447). Hereditary pancreatitis is characterized by recurrent episodes of acute inflammation of the pancreas (pancreatitis) beginning in childhood or adolescence leading to chronic pancreatitis. Chronic pancreatitis is a risk factor for pancreatic cancer (PMID: 25170203). The combination of variants identified in an affected individual impacts the observed clinical features and severity of the disorders (PMID: 20301428, 24624459)."
CHEK2,"The CHEK2 gene is associated with autosomal dominant predisposition to breast, colon, thyroid and prostate cancer (PMID: 15492928, 18759107, 21807500, 21876083, 25431674). Additionally, there is evidence supporting a correlation with CHEK2 and autosomal dominant predisposition to ovarian, renal and urinary tract cancer (PMID: 26681312, 27632928, 26424751, 11719428, 15492928, 29978187); however, the available evidence is insufficient to make a determination regarding these relationships.","The lifetime risk of breast cancer in females with a pathogenic CHEK2 variant is 20-44% (PMID: 18172190, 21876083, 33471974). There is also an increased risk for male breast, colorectal, prostate and thyroid cancers; however, lifetime risks are not established (PMID: 18759107, 21807500, 23713947, 15492928, 25431674). While there is evidence to suggest an increased risk for various primary cancers among homozygotes and compound heterozygotes for most pathogenic CHEK2 variants, these risks are not established (PMID: 30858171, 27900359). For the well-studied c.1100del variant, homozygotes have approximately a 4-6 fold increased risk of breast cancer (PMID: 22058428, 23652375).",,YES,Hide Prostate,"[""Prostate""]","('CHEK2', 'The CHEK2 gene is associated with autosomal dominant predisposition to breast, colon, thyroid and prostate cancer (PMID: 15492928, 18759107, 21807500, 21876083, 25431674). Additionally, there is evidence supporting a correlation with CHEK2 and autosomal dominant predisposition to ovarian, renal and urinary tract cancer (PMID: 26681312, 27632928, 26424751, 11719428, 15492928, 29978187); however, the available evidence is insufficient to make a determination regarding these relationships.', 'The lifetime risk of breast cancer in females with a pathogenic CHEK2 variant is 20-44% (PMID: 18172190, 21876083, 33471974). There is also an increased risk for male breast, colorectal, prostate and thyroid cancers; however, lifetime risks are not established (PMID: 18759107, 21807500, 23713947, 15492928, 25431674). While there is evidence to suggest an increased risk for various primary cancers among homozygotes and compound heterozygotes for most pathogenic CHEK2 variants, these risks are not established (PMID: 30858171, 27900359). For the well-studied c.1100del variant, homozygotes have approximately a 4-6 fold increased risk of breast cancer (PMID: 22058428, 23652375).', '', '0', '[""Prostate""]'),","The CHEK2 gene is associated with autosomal dominant predisposition to breast, colon, thyroid and prostate cancer (PMID: 15492928, 18759107, 21807500, 21876083, 25431674). Additionally, there is evidence supporting a correlation with CHEK2 and autosomal dominant predisposition to ovarian, renal and urinary tract cancer (PMID: 26681312, 27632928, 26424751, 11719428, 15492928, 29978187); however, the available evidence is insufficient to make a determination regarding these relationships.  The lifetime risk of breast cancer in females with a pathogenic CHEK2 variant is 20-44% (PMID: 18172190, 21876083, 33471974). There is also an increased risk for male breast, colorectal, prostate and thyroid cancers; however, lifetime risks are not established (PMID: 18759107, 21807500, 23713947, 15492928, 25431674). While there is evidence to suggest an increased risk for various primary cancers among homozygotes and compound heterozygotes for most pathogenic CHEK2 variants, these risks are not established (PMID: 30858171, 27900359). For the well-studied c.1100del variant, homozygotes have approximately a 4-6 fold increased risk of breast cancer (PMID: 22058428, 23652375)."
CTNNA1,"The CTNNA1 gene is associated with autosomal dominant butterfly-shaped pigmentary macular dystrophy (MedGen UID: 332348). Additionally, CTNNA1 has preliminary evidence supporting a correlation with autosomal dominant hereditary diffuse gastric cancer; however, the available evidence is insufficient to make a determination regarding this relationship (PMID: 23208944, 26182300, 32051609). This result should be considered in the context of personal and family history of diffuse gastric cancer and may warrant additional surveillance (PMID: 32758476). To date, loss-of-function variants in CTNNA1 have not been associated with butterfly-shaped pigmentary macular dystrophy.","Butterfly-shaped pigmentary macular dystrophy is a form of patterned dystrophies of the retinal pigment epithelium, characterized by accumulation of pigment in the macula that resembles the wings of a butterfly (PMID: 12724643). Affected individuals typically present from middle age with mildly reduced visual acuity and color vision. The activity of the RPE measured by electrooculogram (EOG) recordings may be abnormal (PMID: 26691986). Retinitis pigmentosa-like changes have been observed in some cases (PMID: 22466463). The disease is relatively benign, but can progress to atrophy of the choroid and retina, resulting in severe vision loss, though the severity of the disease is highly variable, even within the same family (PMID: 26691986).",,NO,,,"('CTNNA1', 'The CTNNA1 gene is associated with autosomal dominant butterfly-shaped pigmentary macular dystrophy (MedGen UID: 332348). Additionally, CTNNA1 has preliminary evidence supporting a correlation with autosomal dominant hereditary diffuse gastric cancer; however, the available evidence is insufficient to make a determination regarding this relationship (PMID: 23208944, 26182300, 32051609). This result should be considered in the context of personal and family history of diffuse gastric cancer and may warrant additional surveillance (PMID: 32758476). To date, loss-of-function variants in CTNNA1 have not been associated with butterfly-shaped pigmentary macular dystrophy.', 'Butterfly-shaped pigmentary macular dystrophy is a form of patterned dystrophies of the retinal pigment epithelium, characterized by accumulation of pigment in the macula that resembles the wings of a butterfly (PMID: 12724643). Affected individuals typically present from middle age with mildly reduced visual acuity and color vision. The activity of the RPE measured by electrooculogram (EOG) recordings may be abnormal (PMID: 26691986). Retinitis pigmentosa-like changes have been observed in some cases (PMID: 22466463). The disease is relatively benign, but can progress to atrophy of the choroid and retina, resulting in severe vision loss, though the severity of the disease is highly variable, even within the same family (PMID: 26691986).', '', '1', NULL),","The CTNNA1 gene is associated with autosomal dominant butterfly-shaped pigmentary macular dystrophy (MedGen UID: 332348). Additionally, CTNNA1 has preliminary evidence supporting a correlation with autosomal dominant hereditary diffuse gastric cancer; however, the available evidence is insufficient to make a determination regarding this relationship (PMID: 23208944, 26182300, 32051609). This result should be considered in the context of personal and family history of diffuse gastric cancer and may warrant additional surveillance (PMID: 32758476). To date, loss-of-function variants in CTNNA1 have not been associated with butterfly-shaped pigmentary macular dystrophy.  Butterfly-shaped pigmentary macular dystrophy is a form of patterned dystrophies of the retinal pigment epithelium, characterized by accumulation of pigment in the macula that resembles the wings of a butterfly (PMID: 12724643). Affected individuals typically present from middle age with mildly reduced visual acuity and color vision. The activity of the RPE measured by electrooculogram (EOG) recordings may be abnormal (PMID: 26691986). Retinitis pigmentosa-like changes have been observed in some cases (PMID: 22466463). The disease is relatively benign, but can progress to atrophy of the choroid and retina, resulting in severe vision loss, though the severity of the disease is highly variable, even within the same family (PMID: 26691986)."
CTRC,The CTRC gene is associated with an increased risk for chronic pancreatitis (MedGen UID: 116056).,"Chronic and/or hereditary pancreatitis is characterized by recurrent episodes of inflammation of the pancreas (pancreatitis). Penetrance and inheritance patterns of this gene are not well established, but individuals with a pathogenic loss-of-function CTRC variant may have an increased risk for chronic pancreatitis, particularly in the presence of other genetic and environmental risk factors (PMID: 18059268, 18172691, 22942235). Chronic pancreatitis is a risk factor for pancreatic cancer (PMID: 25170203).",,NO,,,"('CTRC', 'The CTRC gene is associated with an increased risk for chronic pancreatitis (MedGen UID: 116056).', 'Chronic and/or hereditary pancreatitis is characterized by recurrent episodes of inflammation of the pancreas (pancreatitis). Penetrance and inheritance patterns of this gene are not well established, but individuals with a pathogenic loss-of-function CTRC variant may have an increased risk for chronic pancreatitis, particularly in the presence of other genetic and environmental risk factors (PMID: 18059268, 18172691, 22942235). Chronic pancreatitis is a risk factor for pancreatic cancer (PMID: 25170203).', '', '0', NULL),","The CTRC gene is associated with an increased risk for chronic pancreatitis (MedGen UID: 116056).  Chronic and/or hereditary pancreatitis is characterized by recurrent episodes of inflammation of the pancreas (pancreatitis). Penetrance and inheritance patterns of this gene are not well established, but individuals with a pathogenic loss-of-function CTRC variant may have an increased risk for chronic pancreatitis, particularly in the presence of other genetic and environmental risk factors (PMID: 18059268, 18172691, 22942235). Chronic pancreatitis is a risk factor for pancreatic cancer (PMID: 25170203)."
DDX41,The DDX41 gene is associated with autosomal dominant familial myeloproliferative/lymphoproliferative neoplasms (MPLPF) (MedGen UID: 895780).,"MPLPF is characterized by hereditary predisposition to adult-onset myeloid malignancies, particularly myelodysplastic syndrome (MDS), acute myeloid leukemia (AML), and in rare cases, lymphoma (PMID: 26712909). The disorder shows incomplete penetrance and the lifetime cancer risk is not known (PMID: 27133828). For information regarding management and surveillance suggestions for individuals with pathogenic variants in DDX41, please refer to PMID: 28600339.",,NO,,,"('DDX41', 'The DDX41 gene is associated with autosomal dominant familial myeloproliferative/lymphoproliferative neoplasms (MPLPF) (MedGen UID: 895780).', 'MPLPF is characterized by hereditary predisposition to adult-onset myeloid malignancies, particularly myelodysplastic syndrome (MDS), acute myeloid leukemia (AML), and in rare cases, lymphoma (PMID: 26712909). The disorder shows incomplete penetrance and the lifetime cancer risk is not known (PMID: 27133828). For information regarding management and surveillance suggestions for individuals with pathogenic variants in DDX41, please refer to PMID: 28600339.', '', '0', NULL),","The DDX41 gene is associated with autosomal dominant familial myeloproliferative/lymphoproliferative neoplasms (MPLPF) (MedGen UID: 895780).  MPLPF is characterized by hereditary predisposition to adult-onset myeloid malignancies, particularly myelodysplastic syndrome (MDS), acute myeloid leukemia (AML), and in rare cases, lymphoma (PMID: 26712909). The disorder shows incomplete penetrance and the lifetime cancer risk is not known (PMID: 27133828). For information regarding management and surveillance suggestions for individuals with pathogenic variants in DDX41, please refer to PMID: 28600339."
DICER1,The DICER1 gene is associated with autosomal dominant DICER1-related pleuropulmonary blastoma familial tumor predisposition syndrome (MedGen UID: 449020).,"DICER1-related pleuropulmonary blastoma familial tumor predisposition syndrome is associated with an increased risk for certain types of rare tumors and cancers that may present in childhood. Noncancerous neoplasias include cystic nephroma, nasal chondromesenchymal hamartomas, thyroid adenomas and goiter. There is also an increased risk of certain malignancies including pleuropulmonary blastoma, ovarian sex cord-stromal tumors, Sertoli-Leydig cell tumors, genitourinary embryonal rhabdomyosarcoma, renal sarcoma, Wilms tumor, thyroid cancer, ciliary body medulloepithelioma, pituitary blastoma and pineoblastoma.",,NO,,,"('DICER1', 'The DICER1 gene is associated with autosomal dominant DICER1-related pleuropulmonary blastoma familial tumor predisposition syndrome (MedGen UID: 449020).', 'DICER1-related pleuropulmonary blastoma familial tumor predisposition syndrome is associated with an increased risk for certain types of rare tumors and cancers that may present in childhood. Noncancerous neoplasias include cystic nephroma, nasal chondromesenchymal hamartomas, thyroid adenomas and goiter. There is also an increased risk of certain malignancies including pleuropulmonary blastoma, ovarian sex cord-stromal tumors, Sertoli-Leydig cell tumors, genitourinary embryonal rhabdomyosarcoma, renal sarcoma, Wilms tumor, thyroid cancer, ciliary body medulloepithelioma, pituitary blastoma and pineoblastoma.', '', '0', NULL),","The DICER1 gene is associated with autosomal dominant DICER1-related pleuropulmonary blastoma familial tumor predisposition syndrome (MedGen UID: 449020).  DICER1-related pleuropulmonary blastoma familial tumor predisposition syndrome is associated with an increased risk for certain types of rare tumors and cancers that may present in childhood. Noncancerous neoplasias include cystic nephroma, nasal chondromesenchymal hamartomas, thyroid adenomas and goiter. There is also an increased risk of certain malignancies including pleuropulmonary blastoma, ovarian sex cord-stromal tumors, Sertoli-Leydig cell tumors, genitourinary embryonal rhabdomyosarcoma, renal sarcoma, Wilms tumor, thyroid cancer, ciliary body medulloepithelioma, pituitary blastoma and pineoblastoma."
