GENE NAME,PARAGRAPH 1 (Gene Association),PARAGRAPH 2 (Gene Condition),PARAGRAPH 3 (Gene Condition Overflow),A2M CURVE,A2M REQUESTS,HideA2MCharts,SQL,Concatenated
MAX,"The MAX gene is associated with autosomal dominant hereditary paraganglioma-pheochromocytoma (PGL-PCC) syndrome (MedGen UID: 313270). There is also evidence suggesting MAX is associated with autosomal dominant predisposition to renal cancer (PMID: 28973655) and pituitary adenomas (PMID: 32201880). The data, however, are preliminary and insufficient to make a determination regarding these relationships.","MAX-associated PGL-PCC syndrome is characterized by malignant or benign PGL and PCC tumors. PGLs are nervous system tumors that often develop within the head, neck, spine, or abdomen. PCCs are adrenal gland tumors that may cause symptoms related to increased hormone secretion, such as rapid heartbeat and high blood pressure (PMID: 21685915, 22452945, 23666964). While both males and females can pass this variant on to their children, there is evidence suggesting the risks of developing MAX-associated tumors are greatest for those who inherit the variant from their father (PMID: 22452945, 33493868).",,NO,,,"('MAX', 'The MAX gene is associated with autosomal dominant hereditary paraganglioma-pheochromocytoma (PGL-PCC) syndrome (MedGen UID: 313270). There is also evidence suggesting MAX is associated with autosomal dominant predisposition to renal cancer (PMID: 28973655) and pituitary adenomas (PMID: 32201880). The data, however, are preliminary and insufficient to make a determination regarding these relationships.', 'MAX-associated PGL-PCC syndrome is characterized by malignant or benign PGL and PCC tumors. PGLs are nervous system tumors that often develop within the head, neck, spine, or abdomen. PCCs are adrenal gland tumors that may cause symptoms related to increased hormone secretion, such as rapid heartbeat and high blood pressure (PMID: 21685915, 22452945, 23666964). While both males and females can pass this variant on to their children, there is evidence suggesting the risks of developing MAX-associated tumors are greatest for those who inherit the variant from their father (PMID: 22452945, 33493868).', '', '0', NULL),","The MAX gene is associated with autosomal dominant hereditary paraganglioma-pheochromocytoma (PGL-PCC) syndrome (MedGen UID: 313270). There is also evidence suggesting MAX is associated with autosomal dominant predisposition to renal cancer (PMID: 28973655) and pituitary adenomas (PMID: 32201880). The data, however, are preliminary and insufficient to make a determination regarding these relationships.  MAX-associated PGL-PCC syndrome is characterized by malignant or benign PGL and PCC tumors. PGLs are nervous system tumors that often develop within the head, neck, spine, or abdomen. PCCs are adrenal gland tumors that may cause symptoms related to increased hormone secretion, such as rapid heartbeat and high blood pressure (PMID: 21685915, 22452945, 23666964). While both males and females can pass this variant on to their children, there is evidence suggesting the risks of developing MAX-associated tumors are greatest for those who inherit the variant from their father (PMID: 22452945, 33493868)."
MEN1,"The MEN1 gene is associated with autosomal dominant multiple endocrine neoplasia type 1 (MEN1) syndrome (MedGen UID: 9957) and familial isolated hyperparathyroidism (FIHP) (OMIM: 145000). Studies also suggest the MEN1 gene may be associated with autosomal dominant predisposition to thyroid cancer (PMID: 30608029) and paraganglioma-pheochromocytoma syndrome (PGL-PCC) (PMID: 22723327, 27572829, 32130200). The data, however, are preliminary and insufficient to make a determination regarding these relationships.","Multiple endocrine neoplasia type 1 is a highly penetrant condition associated with endocrine tumors in the parathyroid, anterior pituitary, thymus, gastro-entero-pancreatic tract and adrenal glands. Affected individuals may also have facial angiofibromas, collagenomas, lipomas, meningiomas, ependymomas and leiomyomas. While most MEN1-associated tumors are noncancerous, there is an increased risk of malignant transformation. Parathyroid tumors are the primary MEN1-associated endocrinopathy with symptoms typically developing at 20-25 years of age (PMID: 32971521).","MEN1 is also associated with autosomal dominant familial isolated hyperparathyroidism (FIHP), characterized by parathyroid adenomas or hyperplasia without other associated tumors or endocrinopathies (PMID: 12213668, 12699448).",NO,,,"('MEN1', 'The MEN1 gene is associated with autosomal dominant multiple endocrine neoplasia type 1 (MEN1) syndrome (MedGen UID: 9957) and familial isolated hyperparathyroidism (FIHP) (OMIM: 145000). Studies also suggest the MEN1 gene may be associated with autosomal dominant predisposition to thyroid cancer (PMID: 30608029) and paraganglioma-pheochromocytoma syndrome (PGL-PCC) (PMID: 22723327, 27572829, 32130200). The data, however, are preliminary and insufficient to make a determination regarding these relationships.', 'Multiple endocrine neoplasia type 1 is a highly penetrant condition associated with endocrine tumors in the parathyroid, anterior pituitary, thymus, gastro-entero-pancreatic tract and adrenal glands. Affected individuals may also have facial angiofibromas, collagenomas, lipomas, meningiomas, ependymomas and leiomyomas. While most MEN1-associated tumors are noncancerous, there is an increased risk of malignant transformation. Parathyroid tumors are the primary MEN1-associated endocrinopathy with symptoms typically developing at 20-25 years of age (PMID: 32971521).', 'MEN1 is also associated with autosomal dominant familial isolated hyperparathyroidism (FIHP), characterized by parathyroid adenomas or hyperplasia without other associated tumors or endocrinopathies (PMID: 12213668, 12699448).', '0', NULL),","The MEN1 gene is associated with autosomal dominant multiple endocrine neoplasia type 1 (MEN1) syndrome (MedGen UID: 9957) and familial isolated hyperparathyroidism (FIHP) (OMIM: 145000). Studies also suggest the MEN1 gene may be associated with autosomal dominant predisposition to thyroid cancer (PMID: 30608029) and paraganglioma-pheochromocytoma syndrome (PGL-PCC) (PMID: 22723327, 27572829, 32130200). The data, however, are preliminary and insufficient to make a determination regarding these relationships.  Multiple endocrine neoplasia type 1 is a highly penetrant condition associated with endocrine tumors in the parathyroid, anterior pituitary, thymus, gastro-entero-pancreatic tract and adrenal glands. Affected individuals may also have facial angiofibromas, collagenomas, lipomas, meningiomas, ependymomas and leiomyomas. While most MEN1-associated tumors are noncancerous, there is an increased risk of malignant transformation. Parathyroid tumors are the primary MEN1-associated endocrinopathy with symptoms typically developing at 20-25 years of age (PMID: 32971521).  MEN1 is also associated with autosomal dominant familial isolated hyperparathyroidism (FIHP), characterized by parathyroid adenomas or hyperplasia without other associated tumors or endocrinopathies (PMID: 12213668, 12699448)."
MET,"The MET gene is associated with autosomal dominant predisposition to hereditary papillary renal cell carcinoma (HPRCC) (MedGen UID: 766) and autosomal recessive deafness (MedGen UID: 899875). Additionally, the MET gene has preliminary evidence supporting a correlation with arthrogryposis involving the upper limbs (PMID: 30777867). The data, however, are preliminary and insufficient to make a determination regarding this relationship.","HPRCC is a rare, highly penetrant hereditary cancer syndrome characterized by an increased lifetime risk of developing type 1 papillary renal cell carcinoma (PRCC) (PMID: 24710684, 9563489, 12647800). These tumors are typically multifocal and bilateral (PMID: 8308957).","Nonsyndromic deafness does not affect any other part of the body. Affected individuals are born with mild to profound hearing loss that typically does not worsen over time. Severity of deafness may vary, even among members of the same family. Intellect and life span are not impacted.",NO,,,"('MET', 'The MET gene is associated with autosomal dominant predisposition to hereditary papillary renal cell carcinoma (HPRCC) (MedGen UID: 766) and autosomal recessive deafness (MedGen UID: 899875). Additionally, the MET gene has preliminary evidence supporting a correlation with arthrogryposis involving the upper limbs (PMID: 30777867). The data, however, are preliminary and insufficient to make a determination regarding this relationship.', 'HPRCC is a rare, highly penetrant hereditary cancer syndrome characterized by an increased lifetime risk of developing type 1 papillary renal cell carcinoma (PRCC) (PMID: 24710684, 9563489, 12647800). These tumors are typically multifocal and bilateral (PMID: 8308957).                         ', 'Nonsyndromic deafness does not affect any other part of the body. Affected individuals are born with mild to profound hearing loss that typically does not worsen over time. Severity of deafness may vary, even among members of the same family. Intellect and life span are not impacted.', '0', NULL),","The MET gene is associated with autosomal dominant predisposition to hereditary papillary renal cell carcinoma (HPRCC) (MedGen UID: 766) and autosomal recessive deafness (MedGen UID: 899875). Additionally, the MET gene has preliminary evidence supporting a correlation with arthrogryposis involving the upper limbs (PMID: 30777867). The data, however, are preliminary and insufficient to make a determination regarding this relationship.  HPRCC is a rare, highly penetrant hereditary cancer syndrome characterized by an increased lifetime risk of developing type 1 papillary renal cell carcinoma (PRCC) (PMID: 24710684, 9563489, 12647800). These tumors are typically multifocal and bilateral (PMID: 8308957).                           Nonsyndromic deafness does not affect any other part of the body. Affected individuals are born with mild to profound hearing loss that typically does not worsen over time. Severity of deafness may vary, even among members of the same family. Intellect and life span are not impacted."
MITF,"The MITF gene is associated with autosomal dominant Waardenburg syndrome, type 2a (MedGen UID: 349786) and autosomal recessive COMMAD syndrome (coloboma, osteopetrosis, microphthalmia, macrocephaly, albinism, and deafness) (MedGen UID: 934592). The c.952G>A (p.Glu318Lys) variant in MITF is associated with autosomal dominant predisposition to cutaneous malignant melanoma (MedGen UID: 463554).","Waardenburg syndrome, type 2a (WS2a) is characterized by congenital deafness and abnormal pigmentation of the iris, hair and skin. Additional neurologic manifestations including intellectual disability and myelination abnormalities have been described. WS2a is distinguished from Waardenburg type 1 by the absence of dystopia canthorum (PMID: 20127975).

COMMAD syndrome is a rare condition characterized by iris coloboma, osteopetrosis, microphthalmia, macrocephaly, albinism and deafness. Due to the limited cases described in the literature, the clinical features and natural history of COMMAD are still unclear and will likely evolve over time. Clinical correlation is advised.",,NO,,,"('MITF', 'The MITF gene is associated with autosomal dominant Waardenburg syndrome, type 2a (MedGen UID: 349786) and autosomal recessive COMMAD syndrome (coloboma, osteopetrosis, microphthalmia, macrocephaly, albinism, and deafness) (MedGen UID: 934592). The c.952G>A (p.Glu318Lys) variant in MITF is associated with autosomal dominant predisposition to cutaneous malignant melanoma (MedGen UID: 463554).', 'Waardenburg syndrome, type 2a (WS2a) is characterized by congenital deafness and abnormal pigmentation of the iris, hair and skin. Additional neurologic manifestations including intellectual disability and myelination abnormalities have been described. WS2a is distinguished from Waardenburg type 1 by the absence of dystopia canthorum (PMID: 20127975).

COMMAD syndrome is a rare condition characterized by iris coloboma, osteopetrosis, microphthalmia, macrocephaly, albinism and deafness. Due to the limited cases described in the literature, the clinical features and natural history of COMMAD are still unclear and will likely evolve over time. Clinical correlation is advised.', '', '0', NULL),","The MITF gene is associated with autosomal dominant Waardenburg syndrome, type 2a (MedGen UID: 349786) and autosomal recessive COMMAD syndrome (coloboma, osteopetrosis, microphthalmia, macrocephaly, albinism, and deafness) (MedGen UID: 934592). The c.952G>A (p.Glu318Lys) variant in MITF is associated with autosomal dominant predisposition to cutaneous malignant melanoma (MedGen UID: 463554).  Waardenburg syndrome, type 2a (WS2a) is characterized by congenital deafness and abnormal pigmentation of the iris, hair and skin. Additional neurologic manifestations including intellectual disability and myelination abnormalities have been described. WS2a is distinguished from Waardenburg type 1 by the absence of dystopia canthorum (PMID: 20127975).

COMMAD syndrome is a rare condition characterized by iris coloboma, osteopetrosis, microphthalmia, macrocephaly, albinism and deafness. Due to the limited cases described in the literature, the clinical features and natural history of COMMAD are still unclear and will likely evolve over time. Clinical correlation is advised."
MLH1,"The MLH1 gene is associated with autosomal dominant Lynch syndrome (also called hereditary nonpolyposis colorectal cancer syndrome, or HNPCC) (MedGen UID: 232603) and autosomal recessive constitutional mismatch repair deficiency syndrome (CMMR-D) (MedGen UID: 78553).","MLH1-related Lynch syndrome is characterized by increased risk of various cancers including colorectal, endometrial, ovarian, urinary tract, gastrointestinal, brain and possibly prostate. Lifetime cancer risks include a 46–61% risk for colorectal cancer, a 5–7% risk for gastric cancer, a 6% risk for pancreatic cancer, up to an 11% risk for cancer of the small intestines, up to a 5% risk for urinary tract cancer, a 2–7% risk for bladder cancer, a 2–4% risk for cancer of the biliary tract and up to a 1.7% risk for brain/nervous system cancer. Affected females also have an increased risk of uterine/endometrial cancer (34-54%) and ovarian cancer (4–20%) (PMID: 21642682, 28754778, 28772289, 19900449, 26385421, 27013479, 18398828, 26657901,19900449, 31337882).","CMMR-D is a cancer syndrome characterized by childhood malignancies, most commonly hematological malignancies and/or brain tumors, as well as very early-onset colorectal cancer. Nearly all affected individuals have clinical findings reminiscent of neurofibromatosis type 1 (NF1) such as cafe-au-lait spots (PMID: 18709565, 20442441, 17539897).",YES,"Hide Endometrial
Hide gastric for males only","[""Endometrial"", ""Gastric:Male""]","('MLH1', 'The MLH1 gene is associated with autosomal dominant Lynch syndrome (also called hereditary nonpolyposis colorectal cancer syndrome, or HNPCC) (MedGen UID: 232603) and autosomal recessive constitutional mismatch repair deficiency syndrome (CMMR-D) (MedGen UID: 78553).', 'MLH1-related Lynch syndrome is characterized by increased risk of various cancers including colorectal, endometrial, ovarian, urinary tract, gastrointestinal, brain and possibly prostate. Lifetime cancer risks include a 46–61% risk for colorectal cancer, a 5–7% risk for gastric cancer, a 6% risk for pancreatic cancer, up to an 11% risk for cancer of the small intestines, up to a 5% risk for urinary tract cancer, a 2–7% risk for bladder cancer, a 2–4% risk for cancer of the biliary tract and up to a 1.7% risk for brain/nervous system cancer. Affected females also have an increased risk of uterine/endometrial cancer (34-54%) and ovarian cancer (4–20%) (PMID: 21642682, 28754778, 28772289, 19900449, 26385421, 27013479, 18398828, 26657901,19900449, 31337882).', 'CMMR-D is a cancer syndrome characterized by childhood malignancies, most commonly hematological malignancies and/or brain tumors, as well as very early-onset colorectal cancer. Nearly all affected individuals have clinical findings reminiscent of neurofibromatosis type 1 (NF1) such as cafe-au-lait spots (PMID: 18709565, 20442441, 17539897).', '0', '[""Endometrial"", ""Gastric:Male""]'),","The MLH1 gene is associated with autosomal dominant Lynch syndrome (also called hereditary nonpolyposis colorectal cancer syndrome, or HNPCC) (MedGen UID: 232603) and autosomal recessive constitutional mismatch repair deficiency syndrome (CMMR-D) (MedGen UID: 78553).  MLH1-related Lynch syndrome is characterized by increased risk of various cancers including colorectal, endometrial, ovarian, urinary tract, gastrointestinal, brain and possibly prostate. Lifetime cancer risks include a 46–61% risk for colorectal cancer, a 5–7% risk for gastric cancer, a 6% risk for pancreatic cancer, up to an 11% risk for cancer of the small intestines, up to a 5% risk for urinary tract cancer, a 2–7% risk for bladder cancer, a 2–4% risk for cancer of the biliary tract and up to a 1.7% risk for brain/nervous system cancer. Affected females also have an increased risk of uterine/endometrial cancer (34-54%) and ovarian cancer (4–20%) (PMID: 21642682, 28754778, 28772289, 19900449, 26385421, 27013479, 18398828, 26657901,19900449, 31337882).  CMMR-D is a cancer syndrome characterized by childhood malignancies, most commonly hematological malignancies and/or brain tumors, as well as very early-onset colorectal cancer. Nearly all affected individuals have clinical findings reminiscent of neurofibromatosis type 1 (NF1) such as cafe-au-lait spots (PMID: 18709565, 20442441, 17539897)."
MRE11,"The MRE11 gene, formerly known as MRE11A, is associated with autosomal recessive ataxia-telangiectasia-like disorder (ATLD) (MedGen UID: 861227). There appears to be phenotypic overlap between ATLD and autosomal recessive Joubert syndrome (PMID: 22863007). Additionally, there are data supporting an association between MRE11 and autosomal dominant predisposition to breast and gynecologic cancer (PMID: 14684699, 24894818, 24549055, 25452441). The evidence, however, is preliminary and insufficient to make a determination regarding these relationships.","ATLD is characterized by progressive cerebellar degeneration resulting in ataxia and oculomotor apraxia (PMID: 15279810). Studies have demonstrated an increased susceptibility to radiation, consistent with a defect in the DNA repair pathway. While this disorder shares some phenotypic features with ataxia-telangiectasia, telangiectasias and immunodeficiency are not present in ATLD (PMID: 15279810, 10612394, 18652530).",,NO,,,"('MRE11', 'The MRE11 gene, formerly known as MRE11A, is associated with autosomal recessive ataxia-telangiectasia-like disorder (ATLD) (MedGen UID: 861227). There appears to be phenotypic overlap between ATLD and autosomal recessive Joubert syndrome (PMID: 22863007). Additionally, there are data supporting an association between MRE11 and autosomal dominant predisposition to breast and gynecologic cancer (PMID: 14684699, 24894818, 24549055, 25452441). The evidence, however, is preliminary and insufficient to make a determination regarding these relationships.                                                ', 'ATLD is characterized by progressive cerebellar degeneration resulting in ataxia and oculomotor apraxia (PMID: 15279810). Studies have demonstrated an increased susceptibility to radiation, consistent with a defect in the DNA repair pathway. While this disorder shares some phenotypic features with ataxia-telangiectasia, telangiectasias and immunodeficiency are not present in ATLD (PMID: 15279810, 10612394, 18652530).', '', '1', NULL),","The MRE11 gene, formerly known as MRE11A, is associated with autosomal recessive ataxia-telangiectasia-like disorder (ATLD) (MedGen UID: 861227). There appears to be phenotypic overlap between ATLD and autosomal recessive Joubert syndrome (PMID: 22863007). Additionally, there are data supporting an association between MRE11 and autosomal dominant predisposition to breast and gynecologic cancer (PMID: 14684699, 24894818, 24549055, 25452441). The evidence, however, is preliminary and insufficient to make a determination regarding these relationships.                                                  ATLD is characterized by progressive cerebellar degeneration resulting in ataxia and oculomotor apraxia (PMID: 15279810). Studies have demonstrated an increased susceptibility to radiation, consistent with a defect in the DNA repair pathway. While this disorder shares some phenotypic features with ataxia-telangiectasia, telangiectasias and immunodeficiency are not present in ATLD (PMID: 15279810, 10612394, 18652530)."
MSH2,"The MSH2 gene is associated with autosomal dominant Lynch syndrome (also called hereditary nonpolyposis colorectal cancer syndrome, or HNPCC) (MedGen UID: 423615) and autosomal recessive constitutional mismatch repair deficiency syndrome (CMMR-D) (MedGen UID: 78553).","MSH2-related Lynch syndrome is characterized by an increased risk of colorectal cancer as well as cancers of the endometrium, ovary, stomach, biliary tract, bladder, urinary tract, prostate, brain and possibly small intestines. Estimated lifetime risks include a 33–52% risk for colorectal cancer, up to a 9% risk for gastric cancer, up to a 1.7% risk for cancer of the biliary tract, a 2-28% risk for urinary tract cancer, a 4-13% risk for bladder cancer and a 3-8% risk for brain cancer. Affected females also have an increased risk of uterine cancer (21-57%) and ovarian cancer (8-38%) while affected males have an elevated risk for prostate cancer (up to 24%) (PMID: 21642682, 28754778, 19900449, 26657901, 31337882, 23091106, 18398828, 27013479).","CMMR-D is a cancer syndrome characterized by childhood malignancies, most commonly hematological malignancies and/or brain tumors, as well as very early-onset colorectal cancer. Nearly all affected individuals have clinical signs reminiscent of neurofibromatosis type 1 (NF1) such as cafe-au-lait spots (PMID: 18709565, 20442441, 17539897).",YES,,,"('MSH2', 'The MSH2 gene is associated with autosomal dominant Lynch syndrome (also called hereditary nonpolyposis colorectal cancer syndrome, or HNPCC) (MedGen UID: 423615) and autosomal recessive constitutional mismatch repair deficiency syndrome (CMMR-D) (MedGen UID: 78553).', 'MSH2-related Lynch syndrome is characterized by an increased risk of colorectal cancer as well as cancers of the endometrium, ovary, stomach, biliary tract, bladder, urinary tract, prostate, brain and possibly small intestines. Estimated lifetime risks include a 33–52% risk for colorectal cancer, up to a 9% risk for gastric cancer, up to a 1.7% risk for cancer of the biliary tract, a 2-28% risk for urinary tract cancer, a 4-13% risk for bladder cancer and a 3-8% risk for brain cancer. Affected females also have an increased risk of uterine cancer (21-57%) and ovarian cancer (8-38%) while affected males have an elevated risk for prostate cancer (up to 24%) (PMID: 21642682, 28754778, 19900449, 26657901, 31337882, 23091106, 18398828, 27013479).', 'CMMR-D is a cancer syndrome characterized by childhood malignancies, most commonly hematological malignancies and/or brain tumors, as well as very early-onset colorectal cancer. Nearly all affected individuals have clinical signs reminiscent of neurofibromatosis type 1 (NF1) such as cafe-au-lait spots (PMID: 18709565, 20442441, 17539897).', '0', NULL),","The MSH2 gene is associated with autosomal dominant Lynch syndrome (also called hereditary nonpolyposis colorectal cancer syndrome, or HNPCC) (MedGen UID: 423615) and autosomal recessive constitutional mismatch repair deficiency syndrome (CMMR-D) (MedGen UID: 78553).  MSH2-related Lynch syndrome is characterized by an increased risk of colorectal cancer as well as cancers of the endometrium, ovary, stomach, biliary tract, bladder, urinary tract, prostate, brain and possibly small intestines. Estimated lifetime risks include a 33–52% risk for colorectal cancer, up to a 9% risk for gastric cancer, up to a 1.7% risk for cancer of the biliary tract, a 2-28% risk for urinary tract cancer, a 4-13% risk for bladder cancer and a 3-8% risk for brain cancer. Affected females also have an increased risk of uterine cancer (21-57%) and ovarian cancer (8-38%) while affected males have an elevated risk for prostate cancer (up to 24%) (PMID: 21642682, 28754778, 19900449, 26657901, 31337882, 23091106, 18398828, 27013479).  CMMR-D is a cancer syndrome characterized by childhood malignancies, most commonly hematological malignancies and/or brain tumors, as well as very early-onset colorectal cancer. Nearly all affected individuals have clinical signs reminiscent of neurofibromatosis type 1 (NF1) such as cafe-au-lait spots (PMID: 18709565, 20442441, 17539897)."
